{
  "id": "cattariariyasaccani",
  "term_thai": "จัตตาริ อริยสัจจานิ",
  "term_iast": "cattāri ariyasaccāni",
  "term_composition": {
    "is_compound": false,
    "components": [],
    "note": ""
  },
  "origin": {
    "type": "ยืมมาและให้ความหมายใหม่",
    "source_tradition": "ภาษาบาลีใช้องค์ประกอบคำที่มีรากร่วมกับภาษาสันสกฤต โดยมีรูปสันสกฤตว่า catvāri āryasatyāni",
    "attestation_before_term": "คำว่า ārya/ariya และ satya/sacca มีใช้ในภาษาสันสกฤตก่อนพุทธศาสนา แต่ยังไม่พบหลักฐานที่เพียงพอว่ารูปคำเต็ม catvāri āryasatyāni มีใช้ก่อนพุทธศาสนา",
    "etymology_versions": [
      {
        "version": "อริยสัจ หมายถึงสัจจะที่เกี่ยวข้องกับพระอริยะ หรือสัจจะที่พระอริยะรู้แจ้ง",
        "type": "ตามประเพณี/พื้นบ้าน",
        "version_source": "วิสุทธิมรรคและอรรถกถาอธิบายว่าเรียก ariyasacca เพราะพระอริยะรู้แจ้งสัจจะเหล่านี้ และยังอธิบายได้ว่าเป็นสัจจะของพระอริยะ",
        "status": "เป็นที่นิยมในประเพณีเถรวาท"
      },
      {
        "version": "ariyasacca อาจแปลได้หลายทาง เช่น “สัจจะของพระอริยะ”, “สัจจะสำหรับผู้ประเสริฐ” หรือ “สัจจะที่ทำให้เป็นผู้ประเสริฐ” ไม่จำเป็นต้องหมายถึง “สัจจะอันประเสริฐ” เพียงอย่างเดียว",
        "type": "ทางวิชาการ (ภาษาศาสตร์)",
        "version_source": "K. R. Norman และ Paul Williams; การอภิปรายร่วมสมัยเรื่องความหมายของ ariyasacca",
        "status": "เป็นที่โต้แย้งในรายละเอียดการแปล"
      }
    ]
  },
  "dating": [
    {
      "type": "ตามประเพณี",
      "value": "สมัยพระพุทธเจ้า",
      "comment": "ตามพระพุทธศาสนาเถรวาท พระพุทธเจ้าทรงแสดงอริยสัจ ๔ เป็นส่วนสำคัญของปฐมเทศนาแก่ปัญจวัคคีย์"
    },
    {
      "type": "ทางวิชาการ",
      "value": "ชั้นต้นของวรรณกรรมพุทธศาสนา",
      "comment": "ถ้อยคำและโครงสร้างของอริยสัจ ๔ ปรากฏอย่างกว้างขวางในพระสูตรหมวดสัจจสังยุตตะและพระสูตรยุคต้นอื่น ๆ แต่ไม่สามารถกำหนดปีที่บัญญัติถ้อยคำนี้ได้อย่างแน่นอน"
    },
    {
      "type": "การมีอยู่ก่อนพุทธกาล",
      "value": "องค์ประกอบคำมีมาก่อนพุทธกาล",
      "comment": "คำที่เป็นรากของ ariya และ sacca มีอยู่ในภาษาอินเดียโบราณก่อนพุทธศาสนา แต่หลักฐานที่พบไม่ได้ยืนยันการใช้คำเต็มนี้ในความหมายทางพุทธศาสนาก่อนพระพุทธเจ้า"
    }
  ],
  "attribution": {
    "traditional": "ตามประเพณีเถรวาท ถือว่าเป็นคำและคำสอนที่พระพุทธเจ้าทรงแสดงเมื่อทรงประกาศธรรมจักรครั้งแรก โดยเฉพาะในธัมมจักกัปปวัตตนสูตร",
    "academic": "นักวิชาการถือว่าอริยสัจ ๔ เป็นองค์ประกอบสำคัญของคำสอนพุทธยุคต้น แต่ไม่สามารถระบุผู้บัญญัติถ้อยคำในรูปที่มีอยู่ในพระไตรปิฎกได้อย่างแน่นอน",
    "consensus": "เห็นพ้องกันสูงว่าแนวคิดเรื่องอริยสัจ ๔ เป็นคำสอนสำคัญของพุทธศาสนายุคต้น แต่รายละเอียดเกี่ยวกับการก่อรูปถ้อยคำและลำดับพัฒนาการยังมีการอภิปรายทางวิชาการ"
  },
  "recorded_by": "คณะสงฆ์และชุมชนพุทธยุคต้นที่ถ่ายทอดพระธรรมด้วยมุขปาฐะ ก่อนถูกรักษาไว้ในพระไตรปิฎกบาลี",
  "school_tradition": "พุทธศาสนายุคต้น; สืบทอดในเถรวาท และมีคู่ขนานในพระพุทธศาสนาสันสกฤตและประเพณีมหายาน",
  "reason_introduced": "คำนี้ใช้เรียกกรอบคำสอน ๔ ประการที่อธิบายปัญหาความทุกข์ เหตุที่ทำให้เกิดขึ้น ความดับทุกข์ และแนวทางไปสู่ความดับทุกข์ จึงทำให้คำสอนส่วนสำคัญของพระพุทธเจ้าถูกกล่าวรวมกันอย่างเป็นระบบ",
  "interpretation": "จัตตาริ อริยสัจจานิ หมายถึง “อริยสัจ ๔” ได้แก่ ทุกข์ เหตุเกิดทุกข์ ความดับทุกข์ และทางปฏิบัติที่นำไปสู่ความดับทุกข์ ในพระสูตร อริยสัจแต่ละข้อไม่ได้เป็นเพียงข้อความให้เชื่อ แต่เป็นสิ่งที่ผู้ปฏิบัติควรรู้และเข้าใจตามหน้าที่ของแต่ละข้อ",
  "language": "บาลี",
  "sources": [
    {
      "status": "หลัก",
      "title": "ธัมมจักกัปปวัตตนสูตร",
      "location": "Saṃyutta Nikāya 56.11",
      "transmission_tradition": "เถรวาท",
      "language": "บาลี",
      "source_type": "พระไตรปิฎก (พระสุตตันตปิฎก)",
      "discrepancies": ""
    },
    {
      "status": "พยาน 1",
      "title": "ปริญเญยยสูตร",
      "location": "Saṃyutta Nikāya 56.29",
      "transmission_tradition": "เถรวาท",
      "language": "บาลี",
      "source_type": "พระไตรปิฎก (พระสุตตันตปิฎก)",
      "discrepancies": "ระบุอริยสัจ ๔ และหน้าที่ต่อแต่ละข้ออย่างชัดเจน ได้แก่ ทุกข์ควรกำหนดรู้ สมุทัยควรละ นิโรธควรทำให้แจ้ง และมรรคควรเจริญ"
    },
    {
      "status": "พยาน 2",
      "title": "ขันธสูตร",
      "location": "Saṃyutta Nikāya 56.13",
      "transmission_tradition": "เถรวาท",
      "language": "บาลี",
      "source_type": "พระไตรปิฎก (พระสุตตันตปิฎก)",
      "discrepancies": "อธิบายรายละเอียดของอริยสัจแต่ละข้อ โดยระบุขันธ์ ๕ ที่ยึดถือว่าเป็นทุกข์ ตัณหาเป็นเหตุเกิดทุกข์ ความดับตัณหาเป็นความดับทุกข์ และอริยมรรคมีองค์ ๘ เป็นทางไปสู่ความดับทุกข์"
    },
    {
      "status": "พยาน 3",
      "title": "มหาสติปัฏฐานสูตร",
      "location": "Dīgha Nikāya 22",
      "transmission_tradition": "เถรวาท",
      "language": "บาลี",
      "source_type": "พระไตรปิฎก (พระสุตตันตปิฎก)",
      "discrepancies": ""
    }
  ],
  "later_mentions": [
    {
      "id": "visuddhimagga-buddhaghosa",
      "parent": "root",
      "author_id": "buddhaghosa",
      "date_updated": "ประมาณคริสต์ศตวรรษที่ ๕",
      "updated_by": "พระพุทธโฆสาจารย์",
      "reason_for_update": "ต้องการอธิบายความหมายและโครงสร้างของอริยสัจ ๔ ให้ละเอียดขึ้นในระบบการปฏิบัติและการอธิบายธรรมของเถรวาท",
      "what_is_new": "อธิบายคำว่าอริยสัจในหลายแง่มุม และแจกแจงลักษณะ ความหมาย หน้าที่ และความสัมพันธ์ของทุกข์ สมุทัย นิโรธ และมรรคอย่างเป็นระบบ",
      "school_tradition": "เถรวาท",
      "source_type": "คัมภีร์อรรถกถา/ปกรณ์วิเศษ",
      "language": "บาลี",
      "source": {
        "title": "Visuddhimagga"
      }
    }
  ]
}