{
  "id": "kammadayada",
  "term_thai": "กรรมทายาดา",
  "term_iast": "kammadāyādā",
  "term_composition": {
    "is_compound": true,
    "components": [
      {
        "part_iast": "kamma",
        "part_meaning": "การกระทำ หรือ กรรม"
      },
      {
        "part_iast": "dāyādā",
        "part_meaning": "ผู้รับมรดก หรือ ทายาท"
      }
    ],
    "note": "เกิดจากการประสมคำระหว่าง 'กมฺม' (การกระทำ) และ 'ทายาท' (ผู้รับมรดก) รวมกันหมายถึง ผู้ที่เป็นทายาทรับมรดกจากการกระทำของตนเอง"
  },
  "origin": {
    "type": "ยืมมาและให้ความหมายใหม่",
    "source_tradition": "ศาสนาพราหมณ์-ฮินดู หรือความคิดเรื่องกฎแห่งกรรมในอินเดียโบราณ",
    "attestation_before_term": "คำว่า 'ทายาท' (dāyāda) มีการใช้อยู่แล้วในสังคมอินเดียโบราณในบริบทของกฎหมายและการสืบทอดมรดกทางครัวเรือน พระพุทธศาสนานำคำนี้มาใช้ในเชิงอุปมาอุปไมยทางจริยธรรมและจิตวิญญาณ",
    "etymology_versions": [
      {
        "version": "กมฺม + ทายาท (ผู้รับมรดกแห่งกรรม)",
        "type": "ทางวิชาการ (ภาษาศาสตร์)",
        "version_source": "พจนานุกรมบาลี-อังกฤษ PTS (Pali Text Society)",
        "status": "เป็นที่ยอมรับทั่วไป"
      }
    ]
  },
  "dating": [
    {
      "type": "ทางวิชาการ",
      "value": "ศตวรรษที่ ๕ ถึง ๔ ก่อนคริสตกาล",
      "comment": "ปรากฏในพระสูตรยุคแรกเริ่มของพระพุทธศาสนา"
    }
  ],
  "attribution": {
    "traditional": "พระสัมมาสัมพุทธเจ้า ทรงใช้ในคำสอนเรื่องข้อเตือนใจ ๕ ประการ (อภิณหปัจจเวกขณ์) และเรื่องผลแห่งกรรม",
    "academic": "เป็นคำอุปมาอุปไมยที่เกิดขึ้นในยุคพุทธกาลเพื่ออธิบายหลักจริยธรรมของพระพุทธศาสนา",
    "consensus": "เห็นพ้องต้องกัน"
  },
  "recorded_by": "พระสงฆ์สาวกในยุคสังคายนาและมุขปาฐะ ก่อนบันทึกเป็นลายลักษณ์อักษร",
  "school_tradition": "เถรวาท",
  "reason_introduced": "ต้องการสอนให้คนเราเห็นว่า ทุกคนต้องรับผิดชอบชีวิตและการกระทำของตัวเอง เหมือนลูกที่ได้รับมรดกจากพ่อแม่ แต่ในทางธรรม สิ่งที่เราจะได้รับแน่ๆ คือผลจากการกระทำของเราเอง",
  "interpretation": "หมายถึง คนเราเป็นผู้รับผลการกระทำของตนเอง ทำสิ่งใดย่อมได้รับผลสิ่งนั้น เช่นเดียวกับลูกที่ได้รับมรดกจากครอบครัว",
  "language": "บาลี",
  "sources": [
    {
      "status": "หลัก",
      "title": "อภิณหปัจจเวกขณสุตต",
      "location": "Aṅguttara Nikāya 5.57",
      "transmission_tradition": "เถรวาท",
      "language": "บาลี",
      "source_type": "พระไตรปิฎก (พระสุตตันตปิฎก)",
      "discrepancies": ""
    },
    {
      "status": "พยาน 1",
      "title": "จูฬกัมมวิภังคสุตต",
      "location": "Majjhima Nikāya 135",
      "transmission_tradition": "เถรวาท",
      "language": "บาลี",
      "source_type": "พระไตรปิฎก (พระสุตตันตปิฎก)",
      "discrepancies": ""
    }
  ],
  "later_mentions": [
    {
      "id": "buddhaghosa-visuddhimagga",
      "parent": "root",
      "author_id": "buddhaghosa",
      "date_updated": "ศตวรรษที่ ๕",
      "updated_by": "พระพุทธโฆษาจารย์",
      "reason_for_update": "เพื่ออธิบายให้คนรุ่นหลังเข้าใจละเอียดขึ้นว่า การกระทำกลายเป็นมรดกติดตัวเราไปได้อย่างไร",
      "what_is_new": "ขยายความเปรียบเทียบว่า การกระทำเป็นเหมือนทรัพย์สมบัติชิ้นเดียวที่ติดตัวเราไปได้ทุกที่ และไม่มีใครแย่งชิงไปจากเราได้",
      "school_tradition": "เถรวาท",
      "source_type": "คัมภีร์อรรถกถา",
      "language": "บาลี",
      "source": {
        "title": "วิสุทธิมรรค"
      }
    }
  ]
}