{
  "id": "phassa",
  "term_thai": "ผัสสะ",
  "term_iast": "phassa",
  "term_composition": {
    "is_compound": false,
    "components": [],
    "note": ""
  },
  "origin": {
    "type": "ยืมมาและให้ความหมายใหม่",
    "source_tradition": "ภาษาอินเดียโบราณ (เวทและอุปนิษัท)",
    "attestation_before_term": "พบคำว่า สปรรศะ (sparsa) ในภาษาสันสกฤตยุคเวท ซึ่งเดิมหมายถึงการสัมผัสทางกายทางกายภาพ",
    "etymology_versions": [
      {
        "version": "มาจากรากศัพท์ สปฤศ (spṛś) ในภาษาสันสกฤต หรือ ผุส (phus) ในภาษาบาลี แปลว่า การถูกต้อง การกระทบ การสัมผัส",
        "type": "ทางวิชาการ (ภาษาศาสตร์)",
        "version_source": "พจนานุกรมบาลี-อังกฤษ ของสมาคมบาลีปกรณ์ (PTS Dictionary)",
        "status": "เป็นที่ยอมรับ"
      },
      {
        "version": "การบรรจบกันของการทำงานของประสาทสัมผัส (เช่น ตา) สิ่งที่มาปรากฏ (เช่น ภาพ) และความรู้แจ้งทางประสาทสัมผัส (เช่น การมองเห็น)",
        "type": "ตามประเพณี/พื้นบ้าน",
        "version_source": "คัมภีร์อรรถกถา (เช่น สัมโมหวิโนทนี และอัฏฐสาลินี)",
        "status": "เป็นที่นิยม"
      }
    ]
  },
  "dating": [
    {
      "type": "การมีอยู่ก่อนพุทธกาล",
      "value": "ประมาณ ๘๐๐–๖๐๐ ปีก่อนคริสตกาล",
      "comment": "พบการใช้คำว่า สปรรศะ ในความหมายทางกายภาพในวรรณคดีอินเดียยุคเวทและอุปนิษัท"
    },
    {
      "type": "ตามประเพณี",
      "value": "๕๔๓ ปีก่อนคริสตกาล",
      "comment": "เริ่มใช้ในความหมายเฉพาะทางพุทธศาสนาในยุคพุทธกาล"
    },
    {
      "type": "ทางวิชาการ",
      "value": "ศตวรรษที่ ๕ ถึงศตวรรษที่ ๓ ก่อนคริสตกาล",
      "comment": "ช่วงเวลาที่มีการรวบรวมพระสูตรและคัมภีร์บาลียุคแรก"
    }
  ],
  "attribution": {
    "traditional": "พระพุทธเจ้า ทรงนำคำนี้มาอธิบายกระบวนการการรับรู้ทางจิตวิทยาและอริยสัจ ๔ ในปฏิจจสมุปบาท",
    "academic": "เกิดจากการปรับใช้คำศัพท์ด้านการสัมผัสทางกายที่มีอยู่เดิมในภาษาอินเดียโบราณ มาใช้เปรียบเทียบกระบวนการทางจิตและการรับรู้ของมนุษย์",
    "consensus": "เห็นพ้องต้องกันเป็นส่วนใหญ่"
  },
  "recorded_by": "พระอรหันตสาวกในคราวการสังคายนาครั้งที่ ๑ และได้รับการบันทึกเป็นลายลักษณ์อักษรในสีกาลังราว พ.ศ. ๔๕๐",
  "school_tradition": "เถรวาท (พระไตรปิฎกบาลี)",
  "reason_introduced": "เพื่อให้เห็นว่าความคิด ความรู้สึก และอารมณ์ไม่ได้เกิดขึ้นเองลอย ๆ แต่เกิดขึ้นเมื่อตา หู จมูก ลิ้น กาย ใจ ไปรับรู้สิ่งต่าง ๆ ชี้ให้เห็นจุดเริ่มต้นที่ทำให้มนุษย์เกิดความชอบ ความไม่ชอบ และความทุกข์",
  "interpretation": "การที่อวัยวะรับสัมผัส (เช่น ตาหรือหู) สิ่งที่ถูกสัมผัส (เช่น ภาพหรือเสียง) และการรับรู้ทางจิต ทำงานร่วมกันในเวลาเดียวกัน จนเกิดเป็นจุดเริ่มต้นของการรับรู้สิ่งต่าง ๆ",
  "language": "บาลี (สืบทอดมาจากภาษาเวท/สันสกฤตคือ sparsa)",
  "sources": [
    {
      "status": "หลัก",
      "title": "มธุปิณฑิกสูตร (Madhupiṇḍika Sutta)",
      "location": "Majjhima Nikāya 18",
      "transmission_tradition": "เถรวาท",
      "language": "บาลี",
      "source_type": "พระไตรปิฎก (พระสุตตันตปิฎก)",
      "discrepancies": ""
    },
    {
      "status": "พยาน 1",
      "title": "มหานิทานสูตร (Mahānidāna Sutta)",
      "location": "Dīgha Nikāya 15",
      "transmission_tradition": "เถรวาท",
      "language": "บาลี",
      "source_type": "พระไตรปิฎก (พระสุตตันตปิฎก)",
      "discrepancies": ""
    },
    {
      "status": "พยาน 2",
      "title": "ผัสสมูละสูตร (Phassamūlaka Sutta)",
      "location": "Saṃyutta Nikāya 36.6",
      "transmission_tradition": "เถรวาท",
      "language": "บาลี",
      "source_type": "พระไตรปิฎก (พระสุตตันตปิฎก)",
      "discrepancies": ""
    }
  ],
  "later_mentions": [
    {
      "id": "dhammasangani-attasalini",
      "parent": "root",
      "author_id": "buddhaghosa",
      "date_updated": "ศตวรรษที่ ๕",
      "updated_by": "พระพุทธโฆษาจารย์",
      "reason_for_update": "เพื่ออธิบายรายละเอียดให้ชัดเจนว่าการรับรู้ทำงานอย่างไรในจิตใจอย่างละเอียด เหมาะสำหรับการศึกษาขั้นสูง",
      "what_is_new": "นิยามผัสสะว่าเป็นองค์ประกอบทางจิต (เจตสิก) ที่ทำหน้าที่กระทบอารมณ์ เปรียบเหมือนวัวสองตัวชนกัน หรือวัวยืนกระทบแดด",
      "school_tradition": "เถรวาท",
      "source_type": "คัมภีร์อรรถกถา (อัฏฐสาลินี อรรถกถาธัมมสังคณี)",
      "language": "บาลี",
      "source": {
        "title": "อัฏฐสาลินี (Atthaśālinī)"
      }
    },
    {
      "id": "abhidharmakosa-vasubandhu",
      "parent": "root",
      "author_id": "vasubandhu",
      "date_updated": "ศตวรรษที่ ๔–๕",
      "updated_by": "พระวสุพันธุ",
      "reason_for_update": "เพื่อจัดหมวดหมู่สภาวะจิตใจและอธิบายกระบวนการรับรู้ตามทัศนะของนิกายฝ่ายมหายานและอภิธรรมยุคหลัง",
      "what_is_new": "จัดให้ผัสสะเป็นหนึ่งในสภาพจิตใจพื้นฐานที่เกิดขึ้นพร้อมกับจิตทุกดวง (มหาภูมิกธรรม)",
      "school_tradition": "สาร์วาสติวาท / มหายาน",
      "source_type": "คัมภีร์อภิธรรม (อภิธรรมโกศพาสยะ)",
      "language": "สันสกฤต",
      "source": {
        "title": "อภิธรรมโกศภาษยะ (Abhidharmakośabhāṣya)"
      }
    }
  ]
}