{
  "id": "jati",
  "term_thai": "ชาติ",
  "term_iast": "jāti",
  "term_composition": {
    "is_compound": false,
    "components": [],
    "note": ""
  },
  "origin": {
    "type": "ยืมมาและให้ความหมายใหม่",
    "source_tradition": "ศาสนาพราหมณ์-ฮินดูเดิม (เวท/อุปนิษัท)",
    "attestation_before_term": "ปรากฏในคัมภีร์เวทและอุปนิษัท ยุคก่อนพุทธกาล โดยหมายถึงการกำเนิด ชนชั้นวรรณะ หรือตระกูล",
    "etymology_versions": [
      {
        "version": "มาจากกิริยามูลฐาน (รากศัพท์) jan แปลว่า เกิด หรือทำให้เกิด รวมกับปัจจัย -ti",
        "type": "ทางวิชาการ (ภาษาศาสตร์)",
        "version_source": "พจนานุกรมบาลี-อังกฤษ ภาษาศาสตร์เปรียบเทียบอินโด-อารยัน (PTS Pali-English Dictionary)",
        "status": "เป็นที่ยอมรับทั่วไป"
      }
    ]
  },
  "dating": [
    {
      "type": "การมีอยู่ก่อนพุทธกาล",
      "value": "ประมาณ ๑,๐๐๐–๖๐๐ ปีก่อนคริสตกาล",
      "comment": "เดิมใช้ในบริบทสังคมและการเกิดตามธรรมชาติ"
    },
    {
      "type": "ทางวิชาการ",
      "value": "ประมาณศตวรรษที่ ๕ ปีก่อนคริสตกาล",
      "comment": "นำมาใช้ในความหมายทางพุทธศาสนาช่วงเริ่มต้นพุทธกาล"
    }
  ],
  "attribution": {
    "traditional": "พระสัมมาสัมพุทธเจ้า ทรงนำมาแสดงในการอธิบายเรื่องการเวียนว่ายตายเกิดและปฏิจจสมุปบาท",
    "academic": "เป็นศัพท์เดิมในภาษาอารยันโบราณที่พระพุทธศาสนานำมากำหนดความหมายใหม่ทางจิตวิทยาและจริยธรรม",
    "consensus": "เห็นพ้องต้องกันสูง"
  },
  "recorded_by": "พระอรหันตสาวกในคราวปฐมสังคายนา และจารึกลงเป็นลายลักษณ์อักษรในสรีลังกาช่วงศตวรรษที่ ๑ ปีก่อนคริสตกาล",
  "school_tradition": "เถรวาท (พุทธศาสนายุคต้น)",
  "reason_introduced": "เพื่อให้ผู้คนเข้าใจว่าความทุกข์ในชีวิตเริ่มต้นมาจากการเกิด และการเกิดใหม่ในวนเวียนแห่งชีวิตนั้นมีสาเหตุมาจากความตั๋วและความไม่รู้",
  "interpretation": "หมายถึงการปรากฏขึ้นของชีวิต การก่อตัวของร่างกายและจิตใจ หรือการได้มาซึ่งร่างกายและประสาทสัมผัสในภพใหม่ รวมทั้งการเกิดของความคิดว่ามีตัวตนในแต่ละช่วงเวลา",
  "language": "บาลี (ภาษาอินโด-อารยันตะวันออกโบราณ)",
  "sources": [
    {
      "status": "หลัก",
      "title": "มหาตัณหาสังขยสูตร",
      "location": "Majjhima Nikāya 38",
      "transmission_tradition": "เถรวาท",
      "language": "บาลี",
      "source_type": "พระไตรปิฎก (พระสุตตันตปิฎก)",
      "discrepancies": ""
    },
    {
      "status": "พยาน 1",
      "title": "วิภังคสูตร",
      "location": "Samyutta Nikāya 12.2",
      "transmission_tradition": "เถรวาท",
      "language": "บาลี",
      "source_type": "พระไตรปิฎก (พระสุตตันตปิฎก)",
      "discrepancies": ""
    }
  ],
  "later_mentions": [
    {
      "id": "visuddhimagga-buddhaghosa",
      "parent": "root",
      "author_id": "buddhaghosa",
      "date_updated": "ประมาณศตวรรษที่ ๕",
      "updated_by": "พระพุทธโฆสาจารย์",
      "reason_for_update": "เพื่ออธิบายรายละเอียดให้ชัดเจนขึ้นว่า การเกิดทำหน้าที่อย่างไรในกิเลสและการเวียนว่ายตายเกิด",
      "what_is_new": "อธิบายแยกแยะลักษณะของการเกิดออกเป็นหลายมิติ เช่น การก้าวลงสู่นครแห่งภพ การก้าวลงสู่ครรภ์ และการปรากฏขึ้นของขันธ์อย่างเป็นระบบ",
      "school_tradition": "เถรวาท",
      "source_type": "คัมภีร์อรรถกถา",
      "language": "บาลี",
      "source": {
        "title": "วิสุทธิมรรค"
      }
    }
  ]
}