{
  "id": "kammassaka",
  "term_thai": "กรรมสสกา",
  "term_iast": "kammassakā",
  "term_composition": {
    "is_compound": true,
    "components": [
      {
        "part_iast": "kamma",
        "part_meaning": "การกระทำ, กรรม"
      },
      {
        "part_iast": "saka",
        "part_meaning": "ของตนเอง"
      }
    ],
    "note": "เกิดจากการประสมคำว่า kamma (กรรม/การกระทำ) + saka (ของตน) โดยมีสระเชื่อมหรือการซ้อนอักษรเป็น kamma-saka (kammassaka) แปลรวมความหมายว่า ผู้ที่มีการกระทำหรือกรรมเป็นของตนเอง"
  },
  "origin": {
    "type": "ยืมมาและให้ความหมายใหม่",
    "source_tradition": "แนวคิดเรื่องกรรมในอินเดียโบราณก่อนพุทธกาล",
    "attestation_before_term": "ปรากฏแนวคิดเรื่องกรรมและการรับผลกรรมในศาสนาพราหมณ์-ฮินดูยุคแรกและคัมภีร์อุปนิษัท แต่นำมาสร้างรูปศัพท์เฉพาะและนิยามใหม่ในเชิงจริยธรรมตามหลักพุทธศาสนา",
    "etymology_versions": [
      {
        "version": "มาจาก kamma (การกระทำ) + saka (ของตน)",
        "type": "ทางวิชาการ (ภาษาศาสตร์)",
        "version_source": "พจนานุกรมบาลี-อังกฤษ (PTS Pali-English Dictionary)",
        "status": "เป็นที่ยอมรับทั่วไป"
      }
    ]
  },
  "dating": [
    {
      "type": "การมีอยู่ก่อนพุทธกาล",
      "value": "ศตวรรษที่ ๖ ก่อนคริสตกาล",
      "comment": "แนวคิดเรื่องการกระทำของตนมีอยู่ก่อนแล้ว แต่รูปศัพท์บาลีนี้ถูกนำมาใช้อย่างเป็นระบบในยุคพุทธกาล"
    },
    {
      "type": "ทางวิชาการ",
      "value": "ศตวรรษที่ ๕ - ๔ ก่อนคริสตกาล",
      "comment": "ช่วงเวลาที่มีการรวบรวมพระสุตตันตปิฎกยุคแรก"
    }
  ],
  "attribution": {
    "traditional": "พระสัมมาสัมพุทธเจ้า ทรงใช้ตรัสสอนแก่สาวกและพราหมณ์ เพื่อชี้ให้เห็นว่าสัตว์โลกทั้งหลายมีกรรมเป็นของตนเอง",
    "academic": "เป็นศัพท์ที่พัฒนาขึ้นในกลุ่มคณะสงฆ์ยุคแรกเพื่อเป็นหลักธรรมพื้นฐานในการอธิบายเรื่องกฎแห่งกรรม",
    "consensus": "เห็นพ้องต้องกันว่าเป็นคำสอนดั้งเดิมในพระไตรปิฎกภาษาบาลีชั้นสุตตันตปิฎก"
  },
  "recorded_by": "พระอรหันต์สาวกในการสังคายนาพระธรรมวินัยครั้งที่ ๑",
  "school_tradition": "เถรวาท / พระสุตตันตปิฎก",
  "reason_introduced": "เพื่อให้ทุกคนเข้าใจว่า ความสุข ความทุกข์ หรือชีวิตที่ดีและแย่ของแต่ละคน ไม่ได้เกิดขึ้นจากโชคชะตาหรือเทพเจ้าบันดาล แต่เกิดจากการกระทำของตัวเราเองทั้งสิ้น",
  "interpretation": "หมายถึง ทุกคนเป็นเจ้าของผลการกระทำของตนเอง ใครทำสิ่งใดไว้ ไม่ว่าจะทำดีหรือทำชั่ว ตัวเขาก็จะต้องเป็นผู้รับผลของการกระทำนั้นเอง",
  "language": "บาลี",
  "sources": [
    {
      "status": "หลัก",
      "title": "จูฬกัมมวิภังคสูตร (พระสุตตันตปิฎก มัชฌิมนิกาย อุปริปัณณาสก์)",
      "location": "Majjhima Nikāya 135",
      "transmission_tradition": "เถรวาท",
      "language": "บาลี",
      "source_type": "พระไตรปิฎก (พระสุตตันตปิฎก)",
      "discrepancies": ""
    },
    {
      "status": "พยาน 1",
      "title": "มหากัมมวิภังคสูตร (พระสุตตันตปิฎก มัชฌิมนิกาย อุปริปัณณาสก์)",
      "location": "Majjhima Nikāya 136",
      "transmission_tradition": "เถรวาท",
      "language": "บาลี",
      "source_type": "พระไตรปิฎก (พระสุตตันตปิฎก)",
      "discrepancies": ""
    },
    {
      "status": "พยาน 2",
      "title": "อภิณหปัจจเวกขณสูตร (พระสุตตันตปิฎก อังคุตตรนิกาย ปัญจกนิบาต)",
      "location": "Aṅguttara Nikāya 5.57",
      "transmission_tradition": "เถรวาท",
      "language": "บาลี",
      "source_type": "พระไตรปิฎก (พระสุตตันตปิฎก)",
      "discrepancies": ""
    }
  ],
  "later_mentions": [
    {
      "id": "buddhaghosa-visuddhimagga",
      "parent": "root",
      "author_id": "buddhaghosa",
      "date_updated": "พุทธศตวรรษที่ ๑๐",
      "updated_by": "พระพุทธโฆสาจารย์",
      "reason_for_update": "เพื่ออธิบายขยายความให้ผู้ปฏิบัติธรรมเข้าใจชัดเจนขึ้นว่า กรรมทำงานอย่างไร และเชื่อมโยงกับการเวียนว่ายตายเกิดอย่างไร",
      "what_is_new": "นำคำนี้ไปจัดหมวดหมู่และอธิบายละเอียดร่วมกับเรื่องปฏิจจสมุปบาท และอธิบายความเข้าใจเรื่องกรรมในฐานะเป็นปัญญาขั้นพื้นฐานของการฝึกตน (กัมมัสสกตาปัญญา)",
      "school_tradition": "เถรวาท (อรรถกถา)",
      "source_type": "คัมภีร์อรรถกถา/ปกรณ์พิเศษ",
      "language": "บาลี",
      "source": {
        "title": "วิสุทธิมรรค (Visuddhimagga)"
      }
    }
  ]
}