{
  "id": "dukkhaariyasacca",
  "term_thai": "ทุกขอริยสัจ",
  "term_iast": "dukkha-ariyasacca",
  "term_composition": {
    "is_compound": true,
    "components": [
      {
        "part_iast": "dukkha",
        "part_meaning": "ทุกข์, ความไม่สบาย"
      },
      {
        "part_iast": "ariya-sacca",
        "part_meaning": "ความจริงอันประเสริฐ"
      }
    ],
    "note": "เป็นการนำ dukkha มาขยาย ariyasacca หมายถึงอริยสัจข้อที่ว่าด้วยทุกข์ หรือความจริงอันประเสริฐเกี่ยวกับทุกข์"
  },
  "origin": {
    "type": "บัญญัติขึ้นใหม่",
    "source_tradition": "พุทธศาสนายุคต้น ใช้ในพระไตรปิฎกบาลีเพื่อเรียกอริยสัจข้อที่หนึ่ง",
    "attestation_before_term": "คำว่า dukkha, ariya และ sacca ล้วนมีการใช้ในภาษาบาลีและบริบทอินเดียก่อนหรือไม่จำเป็นต้องเกิดพร้อมกับพุทธศาสนา แต่ไม่พบหลักฐานที่แสดงว่ารูปคำเชิงหลักธรรม dukkha-ariyasacca มีการใช้เป็นศัพท์เฉพาะก่อนพุทธศาสนา",
    "etymology_versions": [
      {
        "version": "dukkha + ariya-sacca = ความจริงอันประเสริฐว่าด้วยทุกข์",
        "type": "ทางวิชาการ (ภาษาศาสตร์)",
        "version_source": "แหล่งศัพท์บาลีและงานอธิบายอริยสัจ",
        "status": "เป็นที่นิยม"
      },
      {
        "version": "อริยสัจเป็นความจริงที่นำผู้รู้ให้เป็นอริยะ หรือเป็นความจริงที่พระอริยะรู้แจ้ง",
        "type": "ตามประเพณี/พื้นบ้าน",
        "version_source": "คัมภีร์อรรถกถาและคัมภีร์เถรวาท เช่น วิสุทธิมรรค",
        "status": "เป็นคำอธิบายสำคัญในประเพณีเถรวาท"
      }
    ]
  },
  "dating": [
    {
      "type": "ทางวิชาการ",
      "value": "พุทธศาสนายุคต้น ก่อนการจัดทำพระไตรปิฎกเป็นลายลักษณ์อักษร",
      "comment": "รูปคำและแนวคิดปรากฏในพระสูตรชั้นพระไตรปิฎก เช่น ธัมมจักกัปปวัตตนสูตร และสัจจวิภังคสูตร แต่การกำหนดวันที่แน่นอนของข้อความปากเปล่าชั้นต้นทำไม่ได้"
    },
    {
      "type": "ตามประเพณี",
      "value": "พุทธกาล",
      "comment": "ตามประเพณีเถรวาท พระพุทธเจ้าทรงแสดงอริยสัจ ๔ เป็นครั้งแรกแก่ภิกษุปัญจวัคคีย์ที่อิสิปตนมฤคทายวัน"
    }
  ],
  "attribution": {
    "traditional": "ตามประเพณีถือว่าเป็นหลักธรรมที่พระพุทธเจ้าทรงค้นพบและทรงแสดง โดยเฉพาะในธัมมจักกัปปวัตตนสูตร",
    "academic": "ไม่มีหลักฐานที่ระบุว่าบุคคลใดเป็นผู้ประดิษฐ์คำศัพท์นี้โดยเฉพาะ นักวิชาการถือว่าคำนี้เป็นศัพท์ของพุทธศาสนายุคต้นที่ปรากฏในพระไตรปิฎกบาลี",
    "consensus": "มีความเห็นพ้องสูงว่าคำนี้เป็นศัพท์หลักของพุทธศาสนายุคต้น แต่ไม่สามารถระบุผู้บัญญัติคำเป็นรายบุคคลได้"
  },
  "recorded_by": "คณะสงฆ์สาวกในประเพณีพระพุทธศาสนายุคต้น ซึ่งถ่ายทอดคำสอนแบบมุขปาฐะก่อนมีการบันทึกเป็นลายลักษณ์อักษร",
  "school_tradition": "เถรวาท; เป็นศัพท์ที่ปรากฏในพระไตรปิฎกบาลี",
  "reason_introduced": "จำเป็นต้องมีคำเรียกเฉพาะสำหรับความจริงข้อแรกในอริยสัจ ๔ ซึ่งอธิบายลักษณะของชีวิตที่เป็นทุกข์และสิ่งที่ควรกำหนดรู้ คำนี้จึงใช้แยกความหมายของทุกข์ในฐานะอริยสัจออกจากการใช้คำว่า dukkha ในความหมายทั่วไป",
  "interpretation": "หมายถึงความจริงข้อแรกในอริยสัจ ๔ คือ สิ่งที่เรียกว่าเป็นทุกข์ ได้แก่ ความเกิด ความแก่ ความตาย ความเศร้า ความเจ็บปวด ความพลัดพรากจากสิ่งที่รัก การพบสิ่งที่ไม่รัก และการไม่ได้สิ่งที่ปรารถนา โดยสรุปคือขันธ์ ๕ ที่เข้าไปยึดถือเป็นทุกข์",
  "language": "บาลี",
  "sources": [
    {
      "status": "หลัก",
      "title": "Dhammacakkappavattana Sutta",
      "location": "Saṃyutta Nikāya 56.11",
      "transmission_tradition": "เถรวาท",
      "language": "บาลี",
      "source_type": "พระไตรปิฎก (พระสุตตันตปิฎก)",
      "discrepancies": "ฉบับบาลีต่างสายมีรายละเอียดการสะกดและการจัดวรรคตอนแตกต่างกันบ้าง แต่เนื้อหาหลักของ dukkhaṃ ariyasaccaṃ ตรงกัน"
    },
    {
      "status": "พยาน 1",
      "title": "Saccavibhaṅga Sutta",
      "location": "Majjhima Nikāya 141",
      "transmission_tradition": "เถรวาท",
      "language": "บาลี",
      "source_type": "พระไตรปิฎก (พระสุตตันตปิฎก)",
      "discrepancies": "สูตรนี้แจกแจงความหมายของ dukkhaṃ ariyasaccaṃ อย่างละเอียด โดยระบุความเกิด ความแก่ ความตาย ความเศร้า ความคร่ำครวญ ความเจ็บปวด ความโศก ความคับแค้น การพบสิ่งไม่รัก การพรากจากสิ่งรัก และการไม่ได้สิ่งที่ต้องการ รวมถึงสรุปเป็นขันธ์ ๕ ที่ถูกยึดถือ"
    },
    {
      "status": "พยาน 2",
      "title": "Visuddhimagga",
      "location": "Visuddhimagga XIV และ XVI; โดยเฉพาะส่วนอธิบายอริยสัจ",
      "transmission_tradition": "เถรวาท",
      "language": "บาลี",
      "source_type": "คัมภีร์อรรถกถา/คัมภีร์ปกรณ์วิเสส",
      "discrepancies": "วิสุทธิมรรคขยายการวิเคราะห์อริยสัจ โดยอธิบายลักษณะของทุกขอริยสัจและให้กรอบความหมายเชิงวิเคราะห์มากกว่าข้อความพระสูตร"
    }
  ],
  "later_mentions": [
    {
      "id": "buddhaghosa-5th-century",
      "parent": "root",
      "author_id": "buddhaghosa",
      "date_updated": "ประมาณคริสต์ศตวรรษที่ ๕",
      "updated_by": "พระพุทธโฆสาจารย์",
      "reason_for_update": "เพื่ออธิบายคำและหลักธรรมในพระไตรปิฎกให้เป็นระบบและใช้ในการปฏิบัติได้ชัดเจนขึ้น",
      "what_is_new": "ขยายการวิเคราะห์อริยสัจ โดยอธิบายความหมายของทุกขอริยสัจผ่านลักษณะต่าง ๆ และเชื่อมโยงกับหน้าที่ที่ผู้ปฏิบัติควรทำต่ออริยสัจแต่ละข้อ",
      "school_tradition": "เถรวาท",
      "source_type": "อรรถกถาและคู่มือเชิงระบบ",
      "language": "บาลี",
      "source": {
        "title": "Visuddhimagga"
      }
    }
  ]
}