{
  "id": "opanayiko",
  "term_thai": "โอปนยิโก",
  "term_iast": "opanayiko",
  "term_composition": {
    "is_compound": false,
    "components": [],
    "note": ""
  },
  "origin": {
    "type": "ยืมมาและให้ความหมายใหม่",
    "source_tradition": "ประเพณีด้านภาษาและพิธีกรรมอินเดียยุคโบราณ (เวท)",
    "attestation_before_term": "ปรากฏในรูปกริยา upa-nī (นำเข้าไป, นำเข้าหา) ซึ่งในบริบทเวทใช้หมายถึงการนำศิษย์เข้าไปหาอาจารย์ หรือนำเข้าไปสู่พิธีกรรม (อุปนยนพิธี)",
    "etymology_versions": [
      {
        "version": "มาจากคุณศัพท์ opanayika / upanayika ซึ่งสร้างมาจากคำว่า upanaya (การนำเข้าไป, การเข้าใกล้) ในบริบทพุทธหมายถึงคำสอนที่ 'น้อมเข้ามาใส่ใจ' หรือ 'นำผู้ปฏิบัติไปสู่ความหลุดพ้น'",
        "type": "ทางวิชาการ (ภาษาศาสตร์)",
        "version_source": "พจนานุกรมบาลี-อังกฤษ PTS และนักพุทธศาสนศึกษา",
        "status": "เป็นที่นิยม"
      },
      {
        "version": "การวิเคราะห์ตามแนวอรรถกถาเชื่อมโยงกับการนำธรรมะเข้ามาไว้ในใจของตน (อุปเนยยะ) หรือการนำผู้ปฏิบัติไปสู่การสิ้นทุกข์ (นิพพาน)",
        "type": "ตามประเพณี/พื้นบ้าน",
        "version_source": "พระพุทธโฆษาจารย์ (วิสุทธิมรรค) และคัมภีร์อรรถกถา",
        "status": "เป็นที่นิยม"
      }
    ]
  },
  "dating": [
    {
      "type": "การมีอยู่ก่อนพุทธกาล",
      "value": "ศตวรรษที่ ๑๐–๖ ก่อนคริสตกาล",
      "comment": "รูปกริยาและคำนามจากรากศัพท์ upa-nī มีการใช้อย่างแพร่หลายในภาษาเวทในความหมายของการนำเข้าไปหรือการสั่งสอน"
    },
    {
      "type": "ทางวิชาการ",
      "value": "ศตวรรษที่ ๕–๓ ก่อนคริสตกาล",
      "comment": "ช่วงเวลาการรวบรวมพระไตรปิฎกบาลียุคแรก (พระสุตตันตปิฎก) ที่มีการบันทึกบทสรรเสริญพระธรรมคุณ"
    },
    {
      "type": "ตามประเพณี",
      "value": "ศตวรรษที่ ๖–๕ ก่อนคริสตกาล",
      "comment": "สมัยพุทธกาล ซึ่งตามความเชื่อทางศาสนาถือเป็นช่วงเวลาที่พระพุทธเจ้าตรัสบทธรรมคุณ"
    }
  ],
  "attribution": {
    "traditional": "พระสัมมาสัมพุทธเจ้า ในการตรัสถึงคุณลักษณะของพระธรรม (ธัมมานุสสติ)",
    "academic": "คณะสงฆ์ยุคแรกเริ่มในคราวทรงจำและรวบรวมพระธรรมวินัย",
    "consensus": "นักวิชาการมีความเห็นพ้องต้องกันสูงว่าเป็นศัพท์ในชั้นเก่าแก่ที่สุดของพุทธศาสนา"
  },
  "recorded_by": "จารึกลงเป็นลายลักษณ์อักษรโดยพระสงฆ์นิกายเถรวาทในศรีลังกา ราว พ.ศ. ๔๕๔ (สังคายนาครั้งที่ ๕ ที่อาโลกเลณสถาน)",
  "school_tradition": "พุทธศาสนายุคแรก / เถรวาท",
  "reason_introduced": "ต้องการอธิบายว่าพระธรรมคำสอนของพระพุทธเจ้ามีคุณค่าในทางปฏิบัติอย่างไร โดยชี้ให้เห็นว่าคำสอนนี้ไม่ใช่เรื่องทฤษฎีเลื่อนลอย แต่เป็นสิ่งที่ทุกคนควรน้อมเข้ามาปรับใช้กับจิตใจตนเองเพื่อนำไปสู่การพ้นทุกข์",
  "interpretation": "หมายถึง คุณสมบัติประการหนึ่งของพระธรรมที่เป็นสิ่งที่ควรน้อมเข้ามาไว้ในจิตใจของตนเอง หรือเป็นสิ่งที่นำพาผู้ปฏิบัติเดินหน้าไปสู่เป้าหมายสูงสุดคือการดับทุกข์",
  "language": "บาลี (ตรงกับภาษาสันสกฤตว่า aupanayika)",
  "sources": [
    {
      "status": "หลัก",
      "title": "ธัมมานุสสติ (บทสรรเสริญพระธรรมคุณ) ในอังคุตตรนิกาย",
      "location": "Aṅguttara Nikāya 6.10 (และปรากฏในมัชฌิมนิกาย สังยุตตนิกาย)",
      "transmission_tradition": "เถรวาท",
      "language": "บาลี",
      "source_type": "พระไตรปิฎก (พระสุตตันตปิฎก)",
      "discrepancies": "ในคัมภีร์พุทธศาสนามหายานภาษาสันสกฤต (เช่น มหาวัสตุ, ลลิตวิสตระ) จะใช้อักษรว่า aupanayika"
    }
  ],
  "later_mentions": [
    {
      "id": "buddhaghosa-visuddhimagga-opanayiko",
      "parent": "root",
      "author_id": "buddhaghosa",
      "date_updated": "พุทธศตวรรษที่ ๑๐ (ประมาณ ค.ศ. ๔๓๐)",
      "updated_by": "พระพุทธโฆษาจารย์",
      "reason_for_update": "เพื่อขยายความบทสรรเสริญพระธรรมคุณให้พระสงฆ์และพุทธศาสนิกชนเข้าใจความหมายเชิงลึกได้อย่างแจ่มแจ้ง",
      "what_is_new": "อธิบายความหมายแยกเป็น ๒ นัย คือ ๑) พระธรรมควรรอบรู้น้อมนำเข้ามาตั้งไว้ในใจด้วยการปฏิบัติ ๒) อริยมรรคมีองค์ ๘ นำพาผู้ปฏิบัติให้เข้าถึงพระนิพพาน",
      "school_tradition": "เถรวาท",
      "source_type": "คัมภีร์อรรถกถา / ปกรณ์วิเสส",
      "language": "บาลี",
      "source": {
        "title": "วิสุทธิมรรค (อนุสสตินิทเทส)"
      }
    }
  ]
}