{
  "id": "kamma",
  "term_thai": "กรรม (การกระทำ, เจตนา)",
  "term_iast": "kamma",
  "term_composition": {
    "is_compound": false,
    "components": [],
    "note": ""
  },
  "origin": {
    "type": "ยืมมาและให้ความหมายใหม่",
    "source_tradition": "ศาสนาพราหมณ์-ฮินดูเดิม (ยุคเวท)",
    "attestation_before_term": "ปรากฏในคัมภีร์พระเวทและพราหมณะของศาสนาพราหมณ์เดิม โดยคำว่า 'กมฺม' หรือ 'การ์มา' หมายถึงพิธีกรรมทางศาสนา การเซ่นสรวงบูชา หรือการประกอบพิธีกรรมตามหน้าที่",
    "etymology_versions": [
      {
        "version": "มาจากรากศัพท์ภาษาอินโด-อารยัน √กฤ (kṛ) หมายถึง 'ทำ' หรือ 'กระทำ' ผสมกับปัจจัย -มนฺ (man) รวมกันแปลว่า 'สิ่งที่ได้ทำลงไป' หรือ 'การกระทำ'",
        "type": "ทางวิชาการ (ภาษาศาสตร์)",
        "version_source": "นิรุกติศาสตร์ภาษาอินโด-อารยัน และพจนานุกรมบาลี-อังกฤษของสมาคมบาลีปกรณ์ (PTS)",
        "status": "เป็นที่นิยม"
      }
    ]
  },
  "dating": [
    {
      "type": "การมีอยู่ก่อนพุทธกาล",
      "value": "ประมาณ ๒,๐๐๐ - ๑,๐๐๐ ปีก่อนคริสตกาล",
      "comment": "พบการใช้คำว่า 'การ์มา' ในคัมภีร์ฤกเวทและศตปถพราหมณะในความหมายของพิธีกรรม"
    },
    {
      "type": "ทางวิชาการ",
      "value": "ศตวรรษที่ ๕ - ๔ ก่อนคริสตกาล",
      "comment": "ยุคพุทธกาลที่พระพุทธเจ้าทรงนิยามความหมายใหม่ให้เน้นที่ความตั้งใจหรือเจตนาทางศีลธรรม"
    }
  ],
  "attribution": {
    "traditional": "ตามประเพณีเชื่อว่าพระพุทธเจ้าทรงเป็นผู้ปฏิวัติความหมายของคำนี้ โดยทรงตรัสว่า 'เจตนาคือตัวกรรม' ในการแสดงธรรมแก่พุทธบริษัท",
    "academic": "นักวิชาการมองว่าการให้ความหมายใหม่แก่นัยของกรรมเกิดขึ้นในบรรยากาศการปฏิรูปความคิดของกลุ่มนักบวชชรมาณ แต่พระพุทธเจ้าทรงเป็นผู้เน้นย้ำสภาวะทางจิตและการกระทำทางศีลธรรมอย่างสมบูรณ์แบบเป็นรูปธรรมที่สุด",
    "consensus": "นักวิชาการส่วนใหญ่เห็นพ้องต้องกันว่าพุทธศาสนาได้เปลี่ยนความหมายของคำว่ากรรมจากพิธีกรรมภายนอกมาเป็นการกระทำทางศีลธรรมที่เกิดจากเจตนาภายใน"
  },
  "recorded_by": "พระสงฆ์สายพระมหาวิหารในศรีลังกา บันทึกเป็นลายลักษณ์อักษรลงในใบลานเป็นครั้งแรกในการสังคายนาครั้งที่ ๔ (ประมาณ ๘๓ ปีก่อนคริสตกาล)",
  "school_tradition": "พุทธศาสนาเถรวาท / พุทธศาสนายุดแรก",
  "reason_introduced": "คำนี้ถูกนำมาปรับใช้เพื่ออธิบายว่า เหตุใดคนเราจึงเกิดมาแตกต่างกัน และทำไมแต่ละคนจึงประสบความสุขหรือความทุกข์ไม่เหมือนกัน โดยชี้ให้เห็นว่าทุกอย่างเกิดจากความตั้งใจและการกระทำของตนเอง ไม่ใช่เพราะการบันดาลของเทพเจ้าหรือโชคชะตา",
  "interpretation": "กรรม คือ การกระทำที่ทำลงไปโดยมีความตั้งใจ ไม่ว่าจะทำผ่านทางกาย พูดออกมา หรือคิดในใจ ซึ่งทุกการกระทำย่อมส่งผลตามมาเสมอ หากตั้งใจดีก็จะส่งผลดี หากตั้งใจไม่ดีก็จะส่งผลให้เกิดความทุกข์",
  "language": "บาลี (ตรงกับภาษาสันสกฤตว่า Karma / กรรม์)",
  "sources": [
    {
      "status": "หลัก",
      "title": "นิพเพธกสูตร",
      "location": "Aṅguttara Nikāya 6.63",
      "transmission_tradition": "เถรวาท",
      "language": "บาลี",
      "source_type": "พระไตรปิฎก (พระสุตตันตปิฎก)",
      "discrepancies": ""
    },
    {
      "status": "พยาน 1",
      "title": "จุฬกัมมวิภังคสูตร",
      "location": "Majjhima Nikāya 135",
      "transmission_tradition": "เถรวาท",
      "language": "บาลี",
      "source_type": "พระไตรปิฎก (พระสุตตันตปิฎก)",
      "discrepancies": ""
    },
    {
      "status": "พยาน 2",
      "title": "มหากัมมวิภังคสูตร",
      "location": "Majjhima Nikāya 136",
      "transmission_tradition": "เถรวาท",
      "language": "บาลี",
      "source_type": "พระไตรปิฎก (พระสุตตันตปิฎก)",
      "discrepancies": ""
    }
  ],
  "later_mentions": [
    {
      "id": "buddhaghosa-visuddhimagga",
      "parent": "root",
      "author_id": "buddhaghosa",
      "date_updated": "ศตวรรษที่ ๕",
      "updated_by": "พระพุทธโฆษาจารย์",
      "reason_for_update": "เพื่อรวบรวมและจัดระเบียบคำอธิบายเรื่องกรรมที่กระจายอยู่ในพระไตรปิฎกให้เป็นระบบ เพื่อให้ผู้ปฏิบัติธรรมและพระสงฆ์เข้าใจกลไกการทำงานของกรรมได้อย่างละเอียดชัดเจน",
      "what_is_new": "มีการจำแนกประเภทของกรรมอย่างเป็นระบบยิ่งขึ้น เช่น แบ่งตามเวลาที่ให้ผล (กรรมให้ผลในชาตินี้ ชาติหน้า หรือชาติถัด ๆ ไป) และแบ่งตามหน้าที่ของการส่งผล (กรรมนำไปเกิด กรรมสนับสนุน กรรมบีบคั้น กรรมตัดรอน)",
      "school_tradition": "เถรวาท (อรรถกถา)",
      "source_type": "คัมภีร์อรรถกถา/วิสุทธิมรรค",
      "language": "บาลี",
      "source": {
        "title": "วิสุทธิมรรค"
      }
    }
  ]
}