{
  "id": "magga",
  "term_thai": "มรรค",
  "term_iast": "magga",
  "term_composition": {
    "is_compound": false,
    "components": [],
    "note": ""
  },
  "origin": {
    "type": "ยืมมาและให้ความหมายใหม่",
    "source_tradition": "คำอินโด-อารยันโบราณ มีรูปสันสกฤตว่า mārga และมีรูปในภาษาปรากฤตของจารึกพระเจ้าอโศกว่า maga",
    "attestation_before_term": "มีหลักฐานของคำในความหมายว่า ทาง ถนน หรือหนทางในภาษาอินโด-อารยันก่อนการใช้เป็นศัพท์เฉพาะทางพุทธศาสนา",
    "etymology_versions": [
      {
        "version": "สัมพันธ์กับสันสกฤต mārga และรากศัพท์อินโด-ยูโรเปียนที่เกี่ยวกับการค้นหา การติดตามรอย หรือการตามทาง",
        "type": "ทางวิชาการ (ภาษาศาสตร์)",
        "version_source": "พจนานุกรมบาลี-อังกฤษของ Pali Text Society และงานนิรุกติศาสตร์เปรียบเทียบของ Ralph Lilley Turner",
        "status": "เป็นที่นิยม"
      },
      {
        "version": "มรรคคือสิ่งที่ผู้มุ่งสู่นิพพานแสวงหา หรือสิ่งที่ใช้กำจัดกิเลส",
        "type": "ตามประเพณี/พื้นบ้าน",
        "version_source": "อรรถกถาเถรวาท โดยเฉพาะคำอธิบายเรื่องมรรคในวิสุทธิมรรค",
        "status": "เป็นคำอธิบายตามประเพณี ไม่ใช่นิรุกติศาสตร์ทางประวัติศาสตร์"
      }
    ]
  },
  "dating": [
    {
      "type": "การมีอยู่ก่อนพุทธกาล",
      "value": "ก่อนพุทธกาล; ไม่สามารถกำหนดปีที่แน่นอนได้",
      "comment": "คำที่มีความหมายว่า ทางหรือหนทางเป็นคำศัพท์อินโด-อารยันทั่วไป มิใช่คำที่สร้างขึ้นเฉพาะในพระพุทธศาสนา"
    },
    {
      "type": "ทางวิชาการ",
      "value": "ประมาณพุทธศตวรรษที่ ๓-๕ ก่อนคริสตกาลสำหรับการใช้ในพุทธศาสนายุคต้น",
      "comment": "การกำหนดอายุของคำในคัมภีร์แต่ละแห่งทำได้ไม่แน่นอน เพราะคำสอนถูกถ่ายทอดด้วยปากเปล่าก่อนการบันทึกเป็นลายลักษณ์อักษร"
    },
    {
      "type": "ตามประเพณี",
      "value": "สมัยพระพุทธเจ้า",
      "comment": "คัมภีร์เถรวาทถือว่าการใช้คำว่ามรรคในความหมายของทางไปสู่ความดับทุกข์มีมาตั้งแต่คำสอนของพระพุทธเจ้า"
    }
  ],
  "attribution": {
    "traditional": "ตามพระพุทธศาสนาเถรวาท พระพุทธเจ้าทรงใช้คำว่ามรรคเพื่ออธิบายทางปฏิบัติที่นำไปสู่ความดับทุกข์ โดยเฉพาะอริยมรรคมีองค์ ๘",
    "academic": "นักวิชาการไม่ได้ถือว่าพระพุทธเจ้าทรงประดิษฐ์คำว่า magga ขึ้นใหม่ แต่เป็นคำทั่วไปที่มีอยู่ในภาษาอินเดียโบราณ แล้วถูกนำมาใช้เป็นศัพท์ทางพุทธศาสนาเพื่อหมายถึงทางปฏิบัติและทางไปสู่ความหลุดพ้น",
    "consensus": "มีความเห็นพ้องสูงว่าคำนี้เป็นคำเก่าที่มีความหมายทั่วไปว่า ทางหรือหนทาง ส่วนประวัติอย่างละเอียดของการพัฒนาไปเป็นศัพท์เทคนิคทางพุทธศาสนาไม่สามารถระบุได้แน่ชัด"
  },
  "recorded_by": "พระสงฆ์ในสายการถ่ายทอดพระไตรปิฎกเถรวาทเป็นผู้รักษาและถ่ายทอดคำสอนด้วยมุขปาฐะ ก่อนที่พระไตรปิฎกบาลีจะถูกบันทึกเป็นลายลักษณ์อักษรในศรีลังกาตามธรรมเนียมเถรวาทในพุทธศตวรรษที่ ๖ ก่อนคริสตกาล",
  "school_tradition": "เถรวาท; พระพุทธศาสนายุคต้น",
  "reason_introduced": "คำว่า “ทาง” ใช้ได้ดีในการอธิบายวิธีดำเนินไปสู่ความพ้นทุกข์ ในพระพุทธศาสนา มรรคจึงหมายถึงทางปฏิบัติที่นำไปสู่ความดับทุกข์ และในบางบริบทหมายถึงภาวะทางจิตที่เกิดขึ้นเมื่อบรรลุความหลุดพ้นในขั้นต่าง ๆ",
  "interpretation": "โดยทั่วไป มรรคหมายถึงทางหรือหนทาง ในพระพุทธศาสนา หมายถึงทางปฏิบัติที่นำไปสู่ความดับทุกข์ โดยเฉพาะอริยมรรคมีองค์ ๘ และในความหมายที่ละเอียดขึ้นยังใช้เรียกมรรค ๔ ขั้นที่นำไปสู่ความหลุดพ้น ได้แก่ โสดาปัตติมรรค สกทาคามิมรรค อนาคามิมรรค และอรหัตตมรรค",
  "language": "บาลี",
  "sources": [
    {
      "status": "หลัก",
      "title": "มัคควิภังคสูตร",
      "location": "Saṃyutta Nikāya 45.8",
      "transmission_tradition": "เถรวาท",
      "language": "บาลี",
      "source_type": "พระไตรปิฎก (พระสุตตันตปิฎก)",
      "discrepancies": ""
    },
    {
      "status": "พยาน 1",
      "title": "ธัมมจักกัปปวัตตนสูตร",
      "location": "Saṃyutta Nikāya 56.11",
      "transmission_tradition": "เถรวาท",
      "language": "บาลี",
      "source_type": "พระไตรปิฎก (พระสุตตันตปิฎก)",
      "discrepancies": ""
    },
    {
      "status": "พยาน 2",
      "title": "วิภังคปกรณ์",
      "location": "Vibhaṅga 235-252",
      "transmission_tradition": "เถรวาท",
      "language": "บาลี",
      "source_type": "พระไตรปิฎก (พระอภิธรรมปิฎก)",
      "discrepancies": "การอธิบายแบบอภิธรรมจำแนกมรรคอย่างละเอียดขึ้น รวมทั้งความแตกต่างระหว่างมรรคทางโลกกับมรรคเหนือโลก"
    },
    {
      "status": "พยาน 3",
      "title": "พจนานุกรมบาลี-อังกฤษของ Pali Text Society",
      "location": "รายการคำว่า magga, p. 512",
      "transmission_tradition": "ประเพณีบาลีเถรวาท",
      "language": "อังกฤษและบาลี",
      "source_type": "พจนานุกรมวิชาการ",
      "discrepancies": "แยกความหมายทั่วไปว่า ถนน ทาง หรือหนทาง ออกจากความหมายเฉพาะทางพระพุทธศาสนา"
    }
  ],
  "later_mentions": [
    {
      "id": "buddhaghosa",
      "parent": "root",
      "author_id": "buddhaghosa",
      "date_updated": "พุทธศตวรรษที่ ๑๐",
      "updated_by": "พระพุทธโฆสาจารย์",
      "reason_for_update": "ต้องอธิบายให้ละเอียดขึ้นว่าทางปฏิบัติสัมพันธ์กับการชำระจิตและการหลุดพ้นอย่างไร",
      "what_is_new": "ในวิสุทธิมรรค มรรคถูกอธิบายภายในระบบการปฏิบัติอย่างเป็นขั้นตอน และเชื่อมโยงกับอริยสัจ องค์ประกอบของมรรค และการบรรลุนิพพาน รวมทั้งอธิบายมรรค ๔ ขั้นในฐานะเหตุโดยตรงของผลแต่ละระดับ",
      "school_tradition": "เถรวาท",
      "source_type": "คัมภีร์อรรถกถาและคัมภีร์ปฏิบัติธรรมเชิงระบบ",
      "language": "บาลี",
      "source": {
        "title": "วิสุทธิมรรค"
      }
    }
  ]
}
