{
  "id": "bhava",
  "term_thai": "ภพ",
  "term_iast": "bhava",
  "term_composition": {
    "is_compound": false,
    "components": [],
    "note": ""
  },
  "origin": {
    "type": "ยืมมาและให้ความหมายใหม่",
    "source_tradition": "ศาสนาพราหมณ์-เวท (อินเดียโบราณ)",
    "attestation_before_term": "ปรากฏในคัมภีร์เวทและอุปนิษัท หมายถึง 'การกลายเป็น', 'การเกิดขึ้น', หรือ 'ภาวะการมีอยู่ทั่วไป'",
    "etymology_versions": [
      { "version": "มาจากรากศัพท์ภาษาอินโด-ยูโรเปียนดั้งเดิม *bheh₂w- ('กลายเป็น', 'เติบโต') ผ่านภาษาเวท bhū (ภู) แปลว่า 'กลายเป็น' หรือ 'ดำรงอยู่'", "type": "ทางวิชาการ (ภาษาศาสตร์)", "version_source": "นักภาษาศาสตร์เปรียบเทียบอินโด-ยูโรเปียน และพจนานุกรมบาลี-อังกฤษ PTS", "status": "เป็นที่ยอมรับ" },
      { "version": "มาจากรากศัพท์ ภู (ภว) วิเคราะห์ความหมายว่า 'ภาวะแห่งการมีอยู่' หรือ 'สิ่งที่กลายเป็นขึ้นมา'", "type": "ตามประเพณี/พื้นบ้าน", "version_source": "คัมภีร์สัททนีติและคัมภีร์อรรถกถาบาลี", "status": "เป็นที่นิยม" }
    ]
  },
  "dating": [
    { "type": "การมีอยู่ก่อนพุทธกาล", "value": "ยุคเวท (ประมาณ ๑,๕๐๐-๑,๐๐๐ ปีก่อนคริสตกาล)", "comment": "ใช้ในความหมายกว้าง ๆ หมายถึงการเกิดและการดำรงอยู่" },
    { "type": "ทางวิชาการ", "value": "ศตวรรษที่ ๕ ก่อนคริสตกาล", "comment": "พระพุทธเจ้าทรงนำมาใช้และให้ความหมายเฉพาะในทางพุทธศาสนา" }
  ],
  "attribution": {
    "traditional": "พระสัมมาสัมพุทธเจ้า ทรงนำคำที่มีอยู่เดิมมานิยามใหม่ในบริบทของปฏิจจสมุปบาทเพื่ออธิบายกระบวนการเกิดของชีวิตและการเวียนว่ายตายเกิด",
    "academic": "ใช้อยู่ในภาษาอินโด-อารยันโบราณ แต่พุทธศาสนาได้เปลี่ยนความหมายจากเรื่องจิตวิญญาณสถิตนิจนิรันดร์ มาเป็นกระบวนการของเหตุและผลที่เปลี่ยนแปลงตลอดเวลา",
    "consensus": "เห็นพ้องต้องกันสูง"
  },
  "recorded_by": "พระอานนท์และพระสงฆ์สาวกในการสังคายนาครั้งที่ ๑",
  "school_tradition": "พุทธศาสนายุกต์แรก / เถรวาท",
  "reason_introduced": "เพื่อให้ผู้คนเข้าใจว่า ชีวิตและการเกิดใหม่ไม่ได้เกิดขึ้นโดยบังเอิญ และไม่ได้มีวิญญาณเที่ยงแท้ถาวร แต่เป็นผลมาจากความอยากและการกระทำในอดีตที่ส่งผลให้เกิดสภาวะชีวิตใหม่",
  "interpretation": "หมายถึง 'สภาวะการมีชีวิตอยู่' หรือ 'โลกแห่งการเกิด' ซึ่งแบ่งเป็น ๒ ด้านหลัก คือ ด้านการกระทำที่นำไปสู่การเกิดใหม่ (กรรมภพ) และด้านสภาพแวดล้อมหรือระดับชีวิตที่จิตไปเกิด เช่น เป็นมนุษย์ เทวดา หรือสัตว์เดรัจฉาน (อุปปัตติภพ)",
  "language": "บาลี (ตรงกับภาษาสันสกฤตว่า bhava)",
  "sources": [
    { "status": "หลัก", "title": "มหานิทานสูตร", "location": "Dīgha Nikāya 15", "transmission_tradition": "เถรวาท", "language": "บาลี", "source_type": "พระไตรปิฎก (พระสุตตันตปิฎก)", "discrepancies": "" },
    { "status": "พยาน 1", "title": "ภวสูตร", "location": "Aṅguttara Nikāya 3.76", "transmission_tradition": "เถรวาท", "language": "บาลี", "source_type": "พระไตรปิฎก (พระสุตตันตปิฎก)", "discrepancies": "" }
  ],
  "later_mentions": [
    {
      "id": "visuddhimagga-buddhaghosa",
      "parent": "root",
      "author_id": "buddhaghosa",
      "date_updated": "ศตวรรษที่ ๕",
      "updated_by": "พระพุทธโฆษาจารย์",
      "reason_for_update": "เพื่ออธิบายความหมายของภพให้ละเอียดและชัดเจนยิ่งขึ้น สำหรับใช้ในการฝึกสมาธิและการเรียนรู้คัมภีร์",
      "what_is_new": "จัดหมวดหมู่ภพอย่างละเอียดออกเป็น 'กรรมภพ' (การกระทำที่ส่งผลให้เกิด) และ 'อุปปัตติภพ' (การไปเกิดในภพภูมิ ต่าง ๆ เช่น กามภพ รูปภพ อรูปภพ) พร้อมเชื่อมโยงกับเรื่องขันธ์ ๕",
      "school_tradition": "เถรวาท",
      "source_type": "คัมภีร์อรรถกถา/วิสุทธิมรรค",
      "language": "บาลี",
      "source": { "title": "วิสุทธิมรรค" }
    }
  ]
}