{
  "id": "kammayoni",
  "term_thai": "กรรมโยนิ",
  "term_iast": "kammayoni",
  "term_composition": {
    "is_compound": true,
    "components": [
      {
        "part_iast": "kamma",
        "part_meaning": "การกระทำ หรือ กรรม"
      },
      {
        "part_iast": "yoni",
        "part_meaning": "กำเนิด หรือ ที่เกิด"
      }
    ],
    "note": "เกิดจากการประสมกันระหว่างคำว่า kamma (การกระทำ) และ yoni (กำเนิด/ที่เกิด) หมายถึง การมีกรรมเป็นแหล่งกำเนิดหรือเป็นจุดเริ่มต้นของชีวิต"
  },
  "origin": {
    "type": "บัญญัติขึ้นใหม่",
    "source_tradition": "พุทธศาสนายุกต์ต้น",
    "attestation_before_term": "",
    "etymology_versions": [
      {
        "version": "kamma + yoni",
        "type": "ทางวิชาการ (ภาษาศาสตร์)",
        "version_source": "พจนานุกรมบาลี-อังกฤษ สมาคมคัมภีร์บาลี (PTS)",
        "status": "เป็นที่ยอมรับทั่วไป"
      }
    ]
  },
  "dating": [
    {
      "type": "ตามประเพณี",
      "value": "พุทธกาล (ประมาณ ศตวรรษที่ ๖ ถึง ๕ ก่อนคริสตกาล)",
      "comment": "เชื่อว่าเป็นพระดำรัสของพระสัมมาสัมพุทธเจ้า"
    },
    {
      "type": "ทางวิชาการ",
      "value": "ประมาณ ศตวรรษที่ ๕ ถึง ๓ ก่อนคริสตกาล",
      "comment": "ช่วงเวลาที่มีการรวบรวมและท่องจำพระสูตรในยุคพุทธศาสนาแรกเริ่ม"
    }
  ],
  "attribution": {
    "traditional": "พระสัมมาสัมพุทธเจ้า ทรงใช้ในพระธรรมเทศนาเพื่ออธิบายเรื่องกฎแห่งกรรมและการเวียนว่ายตายเกิด",
    "academic": "เป็นศัพท์พุทธศาสนาในยุคแรกเริ่มที่ปรากฏในพระสุตตันตปิฎก (เช่น อังคุตตรนิกาย และ มัชฌิมนิกาย)",
    "consensus": "เห็นพ้องต้องกันอย่างเป็นเอกฉันท์ว่าเป็นศัพท์เฉพาะของพุทธศาสนายุกต์ต้น"
  },
  "recorded_by": "พระสงฆ์สาวกยุคแรกผ่านการสังคายนา และต่อมาได้บันทึกเป็นลายลักษณ์อักษรในศรีลังกา (ประมาณ ๘๓ ปีก่อนคริสตกาล)",
  "school_tradition": "เถรวาท (พุทธศาสนายุกต์ต้น)",
  "reason_introduced": "ต้องการชี้ให้เห็นว่า ชีวิตของสัตว์ทั้งหลายไม่ได้เกิดขึ้นจากเทพเจ้าสร้างขึ้นหรือเกิดจากความบังเอิญ แต่มีกรรมหรือการกระทำของตนเองเป็นจุดกำเนิดและเป็นต้นเหตุของชีวิต",
  "interpretation": "หมายถึง การมีกรรมเป็นที่เกิด หรือการมีผลจากการกระทำของตนเองเป็นแหล่งกำเนิด ให้จินตนาการว่าการกระทำในอดีตและปัจจุบันของเราคือสายพันธุ์หรือแม่พิมพ์ที่สร้างชีวิต สภาพความเป็นอยู่ และลักษณะชีวิตของเราในเวลาต่อมา",
  "language": "บาลี",
  "sources": [
    {
      "status": "หลัก",
      "title": "อภิณหปัจจเวกขณสูตร (Abhiṇhapaccavekkhiṇasutta)",
      "location": "Aṅguttara Nikāya 5.57",
      "transmission_tradition": "เถรวาท",
      "language": "บาลี",
      "source_type": "พระไตรปิฎก (พระสุตตันตปิฎก)",
      "discrepancies": ""
    },
    {
      "status": "พยาน 1",
      "title": "กุกกุโรวาทสูตร (Kukkuravatika Sutta)",
      "location": "Majjhima Nikāya 57",
      "transmission_tradition": "เถรวาท",
      "language": "บาลี",
      "source_type": "พระไตรปิฎก (พระสุตตันตปิฎก)",
      "discrepancies": ""
    }
  ],
  "later_mentions": [
    {
      "id": "visuddhimagga-kammayoni",
      "parent": "root",
      "author_id": "bhadantacariya-buddhaghosa",
      "date_updated": "ประมาณ ศตวรรษที่ ๕",
      "updated_by": "พระพุทธโฆษาจารย์",
      "reason_for_update": "เพื่ออธิบายความหมายของคำว่ากรรมโยนิให้ชัดเจนยิ่งขึ้นแก่ผู้ศึกษาพระธรรมในยุคหลัง",
      "what_is_new": "ขยายความว่า กรรมเป็นเหตุให้เกิดในภพชาติต่าง ๆ และอธิบายเชื่อมโยงเข้ากับเรื่องวงจรอวิชชาและการเวียนว่ายตายเกิด (ปฏิจจสมุปบาท) อย่างเป็นระบบ",
      "school_tradition": "เถรวาท",
      "source_type": "คัมภีร์อรรถกถา / ปกรณ์พิเศษ",
      "language": "บาลี",
      "source": {
        "title": "วิสุทธิมรรค (Visuddhimagga)"
      }
    }
  ]
}