{
  "id": "ariya",
  "term_thai": "อริยะ",
  "term_iast": "ariya",
  "term_composition": {
    "is_compound": false,
    "components": [],
    "note": ""
  },
  "origin": {
    "type": "ยืมมาและให้ความหมายใหม่",
    "source_tradition": "สันสกฤต ārya และรูปคำอินโด-อิหร่านโบราณที่เกี่ยวข้อง",
    "attestation_before_term": "คำสันสกฤต ārya ปรากฏในคัมภีร์พระเวท โดยเฉพาะ Ṛgveda ก่อนพุทธศาสนา และใช้ในความหมายเกี่ยวกับผู้เป็นสมาชิกของกลุ่มสังคมหรือวัฒนธรรมอารยะ รวมถึงความหมายว่า ผู้สูงศักดิ์หรือผู้มีเกียรติ",
    "etymology_versions": [
      {
        "version": "สืบจากคำว่า ārya ซึ่งมีความหมายเดิมเกี่ยวกับผู้เป็นอิสระ ผู้มีฐานะสูง หรือผู้มีเกียรติ",
        "type": "ทางวิชาการ (ภาษาศาสตร์)",
        "version_source": "Giacomo Benedetti, The Meaning and Etymology of ārya (2023); Encyclopaedia Iranica, Arya",
        "status": "เป็นข้อเสนอทางวิชาการที่มีหลักฐานสนับสนุน แต่ประวัติรากศัพท์ที่ลึกกว่านั้นยังเป็นที่โต้แย้ง"
      },
      {
        "version": "แยกความหมายตามนิรุกติศาสตร์แบบคัมภีร์อรรถกถา ว่า ariya คือผู้ที่อยู่ห่างจากกิเลส เช่น ārakā kilesehi",
        "type": "ตามประเพณี/พื้นบ้าน",
        "version_source": "อรรถกถาและคัมภีร์ฝ่ายเถรวาท เช่น Papañcasūdanī และ Visuddhimagga",
        "status": "เป็นที่ยอมรับในประเพณีอรรถกถา แต่ไม่ถือเป็นรากศัพท์ทางประวัติศาสตร์โดยนักภาษาศาสตร์"
      }
    ]
  },
  "dating": [
    {
      "type": "การมีอยู่ก่อนพุทธกาล",
      "value": "อย่างน้อยตั้งแต่สมัยพระเวท",
      "comment": "รูปสันสกฤต ārya ปรากฏใน Ṛgveda ซึ่งเก่ากว่าพุทธศาสนาอย่างมาก"
    },
    {
      "type": "ตามประเพณี",
      "value": "สมัยพระพุทธเจ้า",
      "comment": "ในพระไตรปิฎกบาลีมีการใช้ ariya เป็นศัพท์สำคัญทางธรรม เช่น ariya-sacca และ ariya-magga"
    },
    {
      "type": "ทางวิชาการ",
      "value": "ชั้นคัมภีร์พุทธยุคต้น ก่อนการจารึกพระไตรปิฎกเป็นลายลักษณ์อักษร",
      "comment": "การกำหนดอายุข้อความแต่ละส่วนของพระไตรปิฎกยังเป็นเรื่องที่มีข้อถกเถียง จึงไม่ควรกำหนดปีเฉพาะสำหรับการเริ่มใช้คำนี้ในพุทธศาสนา"
    }
  ],
  "attribution": {
    "traditional": "ไม่ปรากฏประเพณีที่น่าเชื่อถือว่าพระพุทธเจ้าทรงเป็นผู้บัญญัติคำว่า ariya คำนี้มีอยู่ก่อนพุทธศาสนา แต่พระพุทธองค์ทรงนำมาใช้ในบริบทของคำสอนและขยายความหมายให้มีนัยทางจริยธรรมและจิตวิญญาณ",
    "academic": "นักวิชาการเห็นว่าคำนี้เป็นคำเก่าแก่ก่อนพุทธศาสนา ไม่ใช่ศัพท์ที่สร้างขึ้นใหม่โดยพระพุทธเจ้า จุดสำคัญของพุทธศาสนาคือการนำคำเดิมมาใช้กับความหมายเกี่ยวกับผู้ประเสริฐในทางธรรมและสิ่งที่นำไปสู่ความหลุดพ้น",
    "consensus": "ค่อนข้างสูงในเรื่องที่คำนี้มีมาก่อนพุทธศาสนาและมีรากสัมพันธ์กับสันสกฤต ārya แต่ที่มาทางนิรุกติศาสตร์ดั้งเดิมที่ลึกกว่านั้นยังไม่เป็นข้อยุติ"
  },
  "recorded_by": "ในฝ่ายเถรวาท คำนี้ถ่ายทอดในพระไตรปิฎกบาลีผ่านประเพณีมุขปาฐะ ก่อนมีการบันทึกเป็นลายลักษณ์อักษร; ผู้บันทึกเป็นลายลักษณ์อักษรแต่ละยุคไม่ปรากฏชื่อแน่ชัด",
  "school_tradition": "พุทธศาสนายุคต้นและเถรวาท; คำที่มีรากเดียวกันยังปรากฏในพุทธศาสนาสันสกฤต",
  "reason_introduced": "คำนี้มีอยู่แล้วในภาษาอินเดียโบราณ แต่ในพุทธศาสนาถูกนำมาใช้เพื่อเรียกบุคคล สิ่ง หรือแนวทางที่เกี่ยวข้องกับความประเสริฐในทางธรรม โดยเฉพาะสิ่งที่นำออกจากกิเลสและความทุกข์ จึงไม่ได้หมายถึงเพียงคนที่มีชาติกำเนิดสูง",
  "interpretation": "อริยะหมายถึง ผู้ประเสริฐ ผู้สูงส่ง หรือผู้ที่มีคุณสมบัติอันควรแก่การยกย่อง ในบริบทพุทธศาสนา มักหมายถึงผู้ที่พ้นจากความเห็นและความประพฤติแบบสามัญในระดับหนึ่ง โดยเฉพาะผู้ที่เข้าถึงมรรคหรือผลแห่งการตรัสรู้ และยังใช้ขยายความสิ่งที่นำไปสู่ความหลุดพ้น เช่น อริยมรรคและอริยสัจ",
  "language": "บาลี; สัมพันธ์กับสันสกฤต ārya และมีรูปคำบาลีอื่นที่เกี่ยวข้อง เช่น ayira และ ayya",
  "sources": [
    {
      "status": "หลัก",
      "title": "Mahācattārīsakasutta",
      "location": "Majjhima Nikāya 117",
      "transmission_tradition": "เถรวาท",
      "language": "บาลี",
      "source_type": "พระไตรปิฎก (พระสุตตันตปิฎก)",
      "discrepancies": "ในพระสูตร ariya ใช้ขยายคำว่า sammāsamādhi และกำหนดความหมายในบริบทขององค์มรรคทั้งแปด แสดงการใช้คำในความหมายทางธรรม ไม่ใช่เพียงความหมายทางสังคม"
    },
    {
      "status": "พยาน 1",
      "title": "Dhammacakkappavattanasutta",
      "location": "Saṃyutta Nikāya 56.11",
      "transmission_tradition": "เถรวาท",
      "language": "บาลี",
      "source_type": "พระไตรปิฎก (พระสุตตันตปิฎก)",
      "discrepancies": "ใช้ในคำว่า cattāri ariyasaccāni ซึ่งเป็นหนึ่งในการใช้คำว่า ariya ที่สำคัญที่สุดในพุทธศาสนา"
    },
    {
      "status": "พยาน 2",
      "title": "Dīghanikāya",
      "location": "Dīgha Nikāya 1.70; 2.87; 3.64",
      "transmission_tradition": "เถรวาท",
      "language": "บาลี",
      "source_type": "พระไตรปิฎก (พระสุตตันตปิฎก)",
      "discrepancies": "แสดงให้เห็นว่าคำว่า ariya ในพระไตรปิฎกยังสามารถมีความหมายทางสังคมและวัฒนธรรม นอกเหนือจากความหมายทางจิตวิญญาณ"
    },
    {
      "status": "พยาน 3",
      "title": "Pali-English Dictionary",
      "location": "รายการ ariya",
      "transmission_tradition": "การศึกษาภาษาบาลีสมัยใหม่",
      "language": "อังกฤษ/บาลี",
      "source_type": "พจนานุกรมบาลี-อังกฤษ",
      "discrepancies": "Rhys Davids และ Stede ระบุว่า ariya สัมพันธ์กับ Vedic ārya แต่รากศัพท์ยังไม่แน่นอน และแยกความหมายทางเชื้อชาติ สังคม และจริยธรรมออกจากกัน"
    },
    {
      "status": "พยาน 4",
      "title": "The Meaning and Etymology of ārya",
      "location": "Bhasha 2(1), 2023, pp. 123–142",
      "transmission_tradition": "งานวิชาการสมัยใหม่",
      "language": "อังกฤษ",
      "source_type": "บทความวิชาการ",
      "discrepancies": "เสนอว่าความหมายดั้งเดิมของ ārya น่าจะเกี่ยวกับสถานะทางสังคม เช่น ผู้เป็นอิสระหรือผู้มีฐานะสูง มากกว่าความหมายด้านเชื้อชาติ และอธิบายการพัฒนาสู่ความหมายทางศีลธรรมและจิตวิญญาณ"
    }
  ],
  "later_mentions": [
    {
      "id": "buddhaghosa-5c",
      "parent": "root",
      "author_id": "buddhaghosa",
      "date_updated": "ประมาณคริสต์ศตวรรษที่ ๕",
      "updated_by": "พระพุทธโฆสะ (Buddhaghosa)",
      "reason_for_update": "อรรถกถาจำเป็นต้องอธิบายว่าทำไมจึงเรียกบุคคลหรือธรรมบางอย่างว่าอริยะ และเชื่อมคำนี้เข้ากับความบริสุทธิ์และการห่างจากกิเลส",
      "what_is_new": "เพิ่มการอธิบายแบบนิรุกติศาสตร์ตามประเพณี โดยเชื่อม ariya กับการอยู่ห่างจากกิเลส และในกรณี ariyasacca อธิบายได้หลายทาง เช่น เป็นสัจธรรมที่พระอริยะรู้แจ้ง เป็นของพระอริยะ และเป็นสิ่งที่ทำให้ผู้ปฏิบัติเป็นอริยะ",
      "school_tradition": "เถรวาท",
      "source_type": "คัมภีร์อรรถกถาหลังพระไตรปิฎก",
      "language": "บาลี",
      "source": {
        "title": "Visuddhimagga"
      }
    },
    {
      "id": "dhammapala-6c",
      "parent": "buddhaghosa-5c",
      "author_id": "dhammapala",
      "date_updated": "ประมาณคริสต์ศตวรรษที่ ๖",
      "updated_by": "พระธรรมปาละ (Dhammapāla)",
      "reason_for_update": "ต้องการขยายและอธิบายความหมายของศัพท์ในพระสูตรและอรรถกถาให้ละเอียดขึ้น",
      "what_is_new": "เสนอคำอธิบายเชิงนิรุกติศาสตร์ของ ariya เพิ่มเติม โดยเน้นความหมายด้านความประเสริฐและความสัมพันธ์กับการเข้าถึงธรรม",
      "school_tradition": "เถรวาท",
      "source_type": "ฎีกา (คัมภีร์อธิบายอรรถกถา)",
      "language": "บาลี",
      "source": {
        "title": "อรรถกถาและฎีกาของฝ่ายเถรวาท"
      }
    }
  ]
}