{
  "id": "kammabandhu",
  "term_thai": "กรรมพันธุ",
  "term_iast": "kammabandhu",
  "term_composition": {
    "is_compound": true,
    "components": [
      {
        "part_iast": "kamma",
        "part_meaning": "การกระทำ, กรรม"
      },
      {
        "part_iast": "bandhu",
        "part_meaning": "ญาติ, เผ่าพันธุ์, ผู้เกี่ยวข้องกัน"
      }
    ],
    "note": "คำว่า kamma (กรรม) รวมกับ bandhu (ญาติ/เผ่าพันธุ์) หมายถึง การมีผลของการกระทำของตนเองเป็นเสมือนญาติมิตรหรือเผ่าพันธุ์ที่ผูกพันและคอยติดตามตัวไป"
  },
  "origin": {
    "type": "บัญญัติขึ้นใหม่",
    "source_tradition": "",
    "attestation_before_term": "",
    "etymology_versions": [
      {
        "version": "kamma + bandhu",
        "type": "ทางวิชาการ (ภาษาศาสตร์)",
        "version_source": "พจนานุกรมบาลี-อังกฤษ สมาคมพระคัมภีร์บาลี (PTS)",
        "status": "เป็นที่ยอมรับ"
      }
    ]
  },
  "dating": [
    {
      "type": "ตามประเพณี",
      "value": "ยุคพุทธกาล (ประมาณ ๖-๕ ศตวรรษก่อนคริสตกาล)",
      "comment": "เชื่อว่าเป็นพระพุทธพจน์ที่ตรัสสอนในสมัยพุทธกาล"
    },
    {
      "type": "ทางวิชาการ",
      "value": "ประมาณ ๕-๓ ศตวรรษก่อนคริสตกาล",
      "comment": "ปรากฏอยู่ในสัททสูตร อภิณหปัจจเวกขณสูตร และจูฬกัมมวิภังคสูตร ในพระสุตตันตปิฎก"
    }
  ],
  "attribution": {
    "traditional": "พระสัมมาสัมพุทธเจ้า ทรงแสดงธรรมแก่พระภิกษุและสาวก เพื่อให้พิจารณาเน้นย้ำเรื่องกฎแห่งกรรม",
    "academic": "บันทึกไว้ในพระไตรปิฎกภาษาบาลีของสายเถรวาท",
    "consensus": "เป็นที่ยอมรับอย่างเป็นเอกฉันท์ว่าเป็นคำศัพท์บาลีพุทธศาสนายุกต์แรก"
  },
  "recorded_by": "พระอรหันตสาวกในคราวสังคายนาพระธรรมวินัยครั้งที่ ๑ และบันทึกเป็นลายลักษณ์อักษรในสังคายนาครั้งที่ ๔ ที่ประเทศศรีลังกา (ราว พ.ศ. ๔๕๐)",
  "school_tradition": "เถรวาท",
  "reason_introduced": "เพื่อให้ผู้คนเข้าใจว่า ในชีวิตนี้เราไม่มีสิ่งใดเป็นที่พึ่งหรือเป็นญาติที่แท้จริงนอกจากผลของการกระทำของตนเอง จึงควรพิจารณาเน้นย้ำอยู่เสมอเพื่อเลิกทำความชั่วและตั้งใจทำความดี",
  "interpretation": "หมายถึง การที่เรามีผลของการกระทำ (กรรม) เป็นเสมือนญาติพี่น้องหรือเผ่าพันธุ์ คอยติดตาม เป็นเพื่อน และให้ผลแก่ชีวิตเรา ไม่ว่าเราจะทำกรรมดีหรือกรรมชั่วไว้ก็ตาม",
  "language": "บาลี",
  "sources": [
    {
      "status": "หลัก",
      "title": "อภิณหปัจจเวกขณสูตร (อังคุตตรนิกาย ปัญจกนิบาต)",
      "location": "Aṅguttara Nikāya 5.57",
      "transmission_tradition": "เถรวาท",
      "language": "บาลี",
      "source_type": "พระไตรปิฎก (พระสุตตันตปิฎก)",
      "discrepancies": ""
    },
    {
      "status": "หลัก",
      "title": "จูฬกัมมวิภังคสูตร (มัชฌิมนิกาย อุปริปัณณาสก์)",
      "location": "Majjhima Nikāya 135",
      "transmission_tradition": "เถรวาท",
      "language": "บาลี",
      "source_type": "พระไตรปิฎก (พระสุตตันตปิฎก)",
      "discrepancies": ""
    }
  ],
  "later_mentions": [
    {
      "id": "visuddhimagga-kammabandhu",
      "parent": "root",
      "author_id": "buddhaghosa",
      "date_updated": "พุทธศตวรรษที่ ๑๐ (ประมาณ ค.ศ. ๔๓๐)",
      "updated_by": "พระพุทธโฆษาจารย์",
      "reason_for_update": "เพื่อขยายความคำว่ากรรมเป็นเผ่าพันธุ์ให้เห็นภาพชัดเจนขึ้นว่า กรรมเปรียบเสมือนครอบครัวและสายเลือดที่แท้จริงของชีวิต",
      "what_is_new": "อธิบายเปรียบเทียบว่าคนเราไม่อาจพึ่งพาญาติพี่น้องทางกายภาพได้ตลอดไป แต่กรรมที่ทำไว้จะเป็นเหมือนญาติที่ติดตามไปช่วยเหลือหรือลงโทษในทุกชาติภพ",
      "school_tradition": "เถรวาท",
      "source_type": "คัมภีร์อรรถกถา/วิสุทธิมรรค",
      "language": "บาลี",
      "source": {
        "title": "วิสุทธิมรรค (กัมมัฏฐานนิทเทส)"
      }
    }
  ]
}