{
  "id": "svakkhato",
  "term_thai": "สวากขาโต",
  "term_iast": "svākkhāto",
  "term_composition": {
    "is_compound": false,
    "components": [],
    "note": ""
  },
  "origin": {
    "type": "บัญญัติขึ้นใหม่",
    "source_tradition": "",
    "attestation_before_term": "",
    "etymology_versions": [
      {
        "version": "มาจากคำว่า สุ (su-) แปลว่า ดี หรือ ถูกต้อง รวมกับ อาขยาต (ākhyāta) แปลว่า บอก หรือ ประกาศ เมื่อเชื่อมเสียงกันจึงเป็น สวากขาต (svākkhāta)",
        "type": "ทางวิชาการ (ภาษาศาสตร์)",
        "version_source": "พจนานุกรมบาลี-อังกฤษ PTS (Pali Text Society)",
        "status": "เป็นที่นิยม"
      }
    ]
  },
  "dating": [
    {
      "type": "ทางวิชาการ",
      "value": "ศตวรรษที่ ๕ ถึง ๓ ก่อนคริสตกาล",
      "comment": "ช่วงเวลาที่มีการรวบรวมและบันทึกพระสุตตันตปิฎกยุคแรก"
    },
    {
      "type": "ตามประเพณี",
      "value": "ศตวรรษที่ ๖ ถึง ๕ ก่อนคริสตกาล",
      "comment": "ช่วงพุทธกาล"
    }
  ],
  "attribution": {
    "traditional": "ถือว่ามาจากพระสัมมาสัมพุทธเจ้า โดยเป็นบทสรรเสริญพระธรรมบทแรกในบทสวดธัมมานุสสติ (การระลึกถึงคุณของพระธรรม)",
    "academic": "เป็นข้อความสูตรมาตรฐานที่ใช้สวดระลึกถึงพระธรรมมาตั้งแต่ยุคพุทธศาสนาแรกเริ่ม",
    "consensus": "นักวิชาการเห็นพ้องต้องกันว่าเป็นคำที่ใช้บรรยายคุณลักษณะพื้นฐานของพระธรรมในพุทธศาสนายุคแรก"
  },
  "recorded_by": "พระสงฆ์สาวกในยุคแรกเริ่มสืบทอดผ่านการท่องจำด้วยปากเปล่า และได้บันทึกเป็นลายลักษณ์อักษรครั้งแรกในศรีลังกาเมื่อประมาณ พ.ศ. ๔๕๔ (ศตวรรษที่ ๑ ก่อนคริสตกาล)",
  "school_tradition": "พุทธศาสนายุคแรก / เถรวาท",
  "reason_introduced": "คำนี้ถูกนำมาใช้เพื่ออธิบายให้เห็นว่า คำสั่งสอนของพระพุทธเจ้ามีความสมบูรณ์แบบ ชัดเจน แจ่มแจ้ง และไม่มีความผิดพลาดใด ๆ",
  "interpretation": "หมายถึง พระธรรมหรือคำสอนของพระพุทธเจ้าเป็นสิ่งที่สั่งสอนไว้เป็นอย่างดีแล้ว มีความไพเราะถูกต้องทั้งในตอนต้น ตอนกลาง และตอนปลาย ชัดเจน เข้าใจง่าย และนำไปปฏิบัติเพื่อพ้นทุกข์ได้จริง",
  "language": "บาลี",
  "sources": [
    {
      "status": "หลัก",
      "title": "ธชัคคสูตร",
      "location": "Samyutta Nikāya 11.3",
      "transmission_tradition": "เถรวาท",
      "language": "บาลี",
      "source_type": "พระไตรปิฎก (พระสุตตันตปิฎก)",
      "discrepancies": ""
    },
    {
      "status": "พยาน 1",
      "title": "มหาปรินิพพานสูตร",
      "location": "Dīgha Nikāya 16",
      "transmission_tradition": "เถรวาท",
      "language": "บาลี",
      "source_type": "พระไตรปิฎก (พระสุตตันตปิฎก)",
      "discrepancies": ""
    }
  ],
  "later_mentions": [
    {
      "id": "buddhaghosa-visuddhimagga",
      "parent": "root",
      "author_id": "buddhaghosa",
      "date_updated": "พุทธศตวรรษที่ ๑๐ (ศตวรรษที่ ๕ แห่งคริสตกาล)",
      "updated_by": "พระพุทธโฆษาจารย์",
      "reason_for_update": "เพื่ออธิบายความหมายของการสวดระลึกถึงพระธรรมให้พุทธศาสนิกชนเข้าใจได้อย่างละเอียดสำหรับการนำไปใช้ทำสมาธิ",
      "what_is_new": "แยกแยะและอธิบายว่า คำว่า ตรัสไว้ดีแล้ว หมายถึงการประกาศธรรมที่ไม่ผิดเพี้ยน ดีทั้งในขั้นศีล สมาธิ และปัญญา และนำไปสู่พระนิพพานโดยตรง",
      "school_tradition": "เถรวาท",
      "source_type": "คัมภีร์อรรถกถา/ปกรณ์วิเสส",
      "language": "บาลี",
      "source": {
        "title": "วิสุทธิมรรค (ตอนที่ ๒ ธัมมานุสสตินิทเทส)"
      }
    }
  ]
}