{
  "id": "akusalakamma",
  "term_thai": "อกุศลกรรม",
  "term_iast": "akusala-kamma",
  "term_composition": {
    "is_compound": true,
    "components": [
      {
        "part_iast": "akusala",
        "part_meaning": "ไม่ฉลาด, ไม่ดี, ไม่เป็นประโยชน์"
      },
      {
        "part_iast": "kamma",
        "part_meaning": "การกระทำ, การลงมือทำ"
      }
    ],
    "note": "การกระทำที่เกิดจากความไม่รู้ ความโลภ หรือความโกรธ ซึ่งก่อให้เกิดความเดือดร้อนและความทุกข์"
  },
  "origin": {
    "type": "ยืมมาและให้ความหมายใหม่",
    "source_tradition": "ประเพณีอินเดียโบราณ (เวท/พราหมณ์)",
    "attestation_before_term": "คำว่า 'กรรม' และ 'อกุศล' มีใช้มาก่อนพุทธกาล โดยคำว่ากรรมเดิมเน้นที่การทำพิธีกรรม และอกุศลหมายถึงความไม่เชี่ยวชาญหรือไม่เจริญ พระพุทธศาสนาได้นำมาใช้โดยปรับเปลี่ยนให้หมายถึงการกระทำทางจริยธรรมและจิตใจ",
    "etymology_versions": [
      {
        "version": "มาจากอุปสรรค a- (ไม่) + kusala (ตัดความชั่ว หรือ ปัญญาแหลมคมเหมือนหญ้าคา) หมายถึง การกระทำที่ไม่ตัดความชั่วหรือไม่ประกอบด้วยปัญญา",
        "type": "ตามประเพณี/พื้นบ้าน",
        "version_source": "พระพุทธโฆษาจารย์ (คัมภีร์วิสุทธิมรรคและอรรถกถาพระอภิธรรม)",
        "status": "เป็นที่โต้แย้ง"
      },
      {
        "version": "มาจากคำปฏิเสธ a- ผสมกับรากศัพท์ *kus- / kuś- หมายถึง การกระทำที่ไม่เหมาะสม ไม่เจริญ หรือไร้ความเชี่ยวชาญทางจิตใจ",
        "type": "ทางวิชาการ (ภาษาศาสตร์)",
        "version_source": "พจนานุกรมบาลี-อังกฤษ ของสมาคมบาลีปกรณ์ (PTS Dictionary)",
        "status": "เป็นที่นิยม"
      }
    ]
  },
  "dating": [
    {
      "type": "ตามประเพณี",
      "value": "ศตวรรษที่ ๖–๕ ก่อนคริสตกาล",
      "comment": "ช่วงพุทธกาลตามประเพณีพุทธศาสนา"
    },
    {
      "type": "ทางวิชาการ",
      "value": "ศตวรรษที่ ๕–๔ ก่อนคริสตกาล",
      "comment": "ช่วงเวลาที่คำสอนยุคแรกเริ่มก่อตัวและรวบรวมเป็นพระสูตร"
    }
  ],
  "attribution": {
    "traditional": "พระสัมมาสัมพุทธเจ้า ทรงอธิบายความหมายของคำนี้เพื่อสอนเรื่องอกุศลกรรมบถ ๑๐ ประการ",
    "academic": "คณะสงฆ์ยุคแรกเริ่มที่ช่วยกันรวบรวมคำสอน ได้เรียบเรียงและให้ความหมายแก่คำนี้ในฐานะแนวคิดทางจริยธรรมและจิตวิทยา",
    "consensus": "นักวิชาการยอมรับตรงกันว่าพระพุทธศาสนาได้ปรับความหมายของอกุศลกรรมให้กลายเป็นเรื่องของเจตนาและคุณภาพจิตใจ"
  },
  "recorded_by": "จารึกลงเป็นลายลักษณ์อักษรครั้งแรกในรัชสมัยพระเจ้าวัฏฏคามณีอภัยแห่งศรีลังกา (ราว ๘๐ ปีก่อนคริสตกาล)",
  "school_tradition": "พุทธศาสนายุกแรก / เถรวาท",
  "reason_introduced": "คำนี้ถูกนำมาใช้เพื่อเตือนสติว่า การกระทำที่เกิดจากความเห็นแก่ตัว ความโกรธ หรือความหลง จะสร้างความเสียหายและส่งผลเป็นความทุกข์แก่ตนเองและผู้อื่นเสมอ",
  "interpretation": "หมายถึง การกระทำไม่ว่าจะทางกาย วาจา หรือใจ ที่ทำขึ้นด้วยความโลภ ความโกรธ หรือความเบลอไม่รู้ความจริง ซึ่งการกระทำเหล่านี้ทำให้จิตใจเศร้าหมองและนำความทุกข์เดือดร้อนมาให้",
  "language": "บาลี",
  "sources": [
    {
      "status": "หลัก",
      "title": "เสยยัตถกสูตร / เจตนาสูตร",
      "location": "Aṅguttara Nikāya 10.176, 6.63",
      "transmission_tradition": "เถรวาท",
      "language": "บาลี",
      "source_type": "พระไตรปิฎก (พระสุตตันตปิฎก)",
      "discrepancies": ""
    }
  ],
  "later_mentions": [
    {
      "id": "buddhaghosa-visuddhimagga",
      "parent": "root",
      "author_id": "buddhaghosa",
      "date_updated": "ศตวรรษที่ ๕",
      "updated_by": "พระพุทธโฆษาจารย์",
      "reason_for_update": "ต้องการอธิบายรายละเอียดว่าจิตใจที่หมองมัวแต่ละประเภท ส่งผลให้เกิดการกระทำไม่ดีและได้รับผลกรรมที่แตกต่างกันอย่างไร",
      "what_is_new": "มีการจำแนกอกุศลกรรมและอกุศลจิตออกเป็นประเภทต่างๆ อย่างละเอียด และชี้ให้เห็นโทษของการกระทำไม่ดีที่จะส่งผลขัดขวางการทำสมาธิและการบรรลุธรรม",
      "school_tradition": "เถรวาท",
      "source_type": "คัมภีร์อรรถกถา/ปกรณ์พิเศษ",
      "language": "บาลี",
      "source": {
        "title": "คัมภีร์วิสุทธิมรรค"
      }
    }
  ]
}
